{"affected_claims":["PM-CLAIM-6001","PM-CLAIM-6002","PM-CLAIM-6003","PM-CLAIM-6004"],"id":"PM-LIMITATION-6002","identified_at":"2026-08-01T00:00:00Z","mitigation":"Treat compromise revocation conservatively for every signature under the revoked key.","next_review_at":null,"owner":"ITDO Inc.","record_type":"known-limitation","references":["docs/KEY_AND_REVOCATION_BOUNDARY.md"],"reviewed_at":"2026-08-01T00:00:00Z","schema_version":"0.1","severity":"medium","statement":"No trusted timestamp establishes whether a signature predates a key compromise.","status":"accepted"}