{"affected_claims":["PM-CLAIM-6001","PM-CLAIM-6002","PM-CLAIM-6003","PM-CLAIM-6004"],"id":"PM-LIMITATION-6001","identified_at":"2026-08-01T00:00:00Z","mitigation":"Require a separate reviewed production key-custody and trust-root decision before any real release.","next_review_at":null,"owner":"ITDO Inc.","record_type":"known-limitation","references":["docs/KEY_AND_REVOCATION_BOUNDARY.md"],"reviewed_at":"2026-08-01T00:00:00Z","schema_version":"0.1","severity":"medium","statement":"The fixture keys and trust root are synthetic and not production trust anchors.","status":"accepted"}